{
  "schema_version": "1.0",
  "draft_id": "draft-101",
  "tenant_id": "tenant-42",
  "name": "User Onboarding Journey",
  "description": "Draft workflow for new user welcome campaign",
  "version": 1,
  "nodes": [
    {
      "id": "node-1",
      "type": "trigger",
      "name": "On User Signup",
      "config": {
        "event_type": "user.signup.v1"
      },
      "position": {
        "x": 100,
        "y": 200
      }
    },
    {
      "id": "node-2",
      "type": "action",
      "name": "Send Welcome Email",
      "config": {
        "template_id": "tpl_welcome_01"
      },
      "position": {
        "x": 300,
        "y": 200
      }
    }
  ],
  "edges": [
    {
      "id": "edge-1-2",
      "source": "node-1",
      "target": "node-2",
      "condition": "true"
    }
  ],
  "content_hash": "a1b2c3d4e5f67890123456789abcdef0123456789abcdef0123456789abcdef0",
  "created_at": "2026-07-27T14:00:00Z",
  "updated_at": "2026-07-27T14:05:00Z"
}
